{
  "task": "Execute negotiation strategy crafting",
  "objective": "Deliver Negotiation Strategy Crafting for cybersecurity operations outcome with guardrails",
  "constraints": [
    "Preserve safety checks",
    "Provide measurable KPIs"
  ],
  "context": {
    "urgency": "medium",
    "riskTolerance": "medium",
    "budgetTier": "medium"
  }
}
