{
  "task": "Execute attack-surface modeling",
  "objective": "Deliver Governance Security Threat Modeler outcome with guardrails",
  "constraints": [
    "Preserve safety checks",
    "Provide measurable KPIs"
  ],
  "context": {
    "urgency": "medium",
    "riskTolerance": "medium",
    "budgetTier": "medium"
  }
}
