{
  "task": "Execute human approval routing",
  "objective": "Deliver Human Approval Routing for personal finance management outcome with guardrails",
  "constraints": [
    "Preserve safety checks",
    "Provide measurable KPIs"
  ],
  "context": {
    "urgency": "medium",
    "riskTolerance": "medium",
    "budgetTier": "medium"
  }
}
