{
  "task": "Execute security threat modeling",
  "objective": "Deliver Security Threat Modeling for product management execution outcome with guardrails",
  "constraints": [
    "Preserve safety checks",
    "Provide measurable KPIs"
  ],
  "context": {
    "urgency": "medium",
    "riskTolerance": "medium",
    "budgetTier": "medium"
  }
}
