{
  "task": "Execute incident playbook synthesis",
  "objective": "Deliver Incident Playbook Synthesis for nonprofit program delivery outcome with guardrails",
  "constraints": [
    "Preserve safety checks",
    "Provide measurable KPIs"
  ],
  "context": {
    "urgency": "medium",
    "riskTolerance": "medium",
    "budgetTier": "medium"
  }
}
